{
  "$schema": "./schema.json",
  "schemaVersion": 1,
  "packages": [
    {
      "path": ".",
      "manifest": "package.json",
      "name": "curiosity",
      "private": true,
      "role": "root",
      "scripts": {
        "build": "turbo run build",
        "dev": "turbo run dev",
        "lint": "turbo run lint",
        "format": "prettier --write \"**/*.{ts,tsx,md}\"",
        "check-types": "turbo run check-types",
        "test": "node --test --test-concurrency=1 tools/status/status.test.mjs tools/verification/*.test.mjs && turbo run test",
        "verify": "bun run inventory:check && bun run status:check && turbo run verify && node tools/verification/runtime-plugin-contract.mjs --no-build",
        "inventory:check": "node --test --test-concurrency=1 tools/verification/*.test.mjs && node tools/verification/inventory.mjs",
        "status:check": "node --test tools/status/status.test.mjs && node tools/status/status.mjs",
        "status:write": "node tools/status/status.mjs --write",
        "verify:legacy-memory-parity": "node apps/plugin/opencode2/tools/verify-legacy-memory-native-parity.mjs --verify-dependency-receipt && bun run --cwd apps/plugin/opencode2 build && node apps/plugin/opencode2/tools/verify-legacy-memory-native-parity.mjs --verify-baseline-blobs && node apps/plugin/opencode2/tools/verify-legacy-memory-native-parity.mjs",
        "verify:legacy-memory-node-api-sdk": "bun apps/plugin/opencode2/tests/qualification/verify-legacy-memory-node-api-sdk.mjs",
        "verify:legacy-memory-node-api-sdk-v2": "bun apps/plugin/opencode2/tests/qualification/verify-legacy-memory-node-api-sdk-v2.mjs",
        "contract:runtime-plugin": "node tools/verification/runtime-plugin-contract.mjs",
        "runtime:portable": "bun run --cwd apps/runtime verify:portable",
        "runtime:network-denied": "bun run --cwd apps/runtime test:network-denied",
        "runtime:darwin-compatibility": "bun run --cwd apps/runtime verify:darwin-compatibility"
      },
      "exports": null,
      "bin": null,
      "files": [],
      "implicitConfigSubpaths": [
        "turbo.json",
        ".npmrc"
      ],
      "dependencies": [
        {
          "name": "@curiosity/runtime",
          "section": "devDependencies",
          "version": "workspace:*",
          "classification": "workspace",
          "protocol": "workspace"
        },
        {
          "name": "ajv",
          "section": "devDependencies",
          "version": "8.17.1",
          "classification": "external",
          "protocol": "exact"
        },
        {
          "name": "he",
          "section": "devDependencies",
          "version": "1.2.0",
          "classification": "external",
          "protocol": "exact"
        },
        {
          "name": "marked",
          "section": "devDependencies",
          "version": "12.0.2",
          "classification": "external",
          "protocol": "exact"
        },
        {
          "name": "prettier",
          "section": "devDependencies",
          "version": "^3.7.4",
          "classification": "external",
          "protocol": "caret"
        },
        {
          "name": "turbo",
          "section": "devDependencies",
          "version": "^2.10.10",
          "classification": "external",
          "protocol": "caret"
        },
        {
          "name": "typescript",
          "section": "devDependencies",
          "version": "5.9.2",
          "classification": "external",
          "protocol": "exact"
        }
      ],
      "workspaceMember": false,
      "executionMetadata": [
        {
          "kind": "lifecycle-script",
          "path": "scripts.test",
          "value": "node --test --test-concurrency=1 tools/status/status.test.mjs tools/verification/*.test.mjs && turbo run test",
          "classification": "reviewed",
          "reason": "Reviewed npm lifecycle entrypoint; execution remains limited to its classified command graph."
        },
        {
          "kind": "trust-policy",
          "path": "trustedDependencies",
          "value": [],
          "classification": "reviewed",
          "reason": "The explicit empty root allowlist disables Bun implicit default trust; CI also ignores all lifecycle scripts."
        }
      ]
    },
    {
      "path": "apps/custom-harness",
      "manifest": "apps/custom-harness/package.json",
      "name": "@curiosity/custom-harness",
      "private": true,
      "role": "harness",
      "scripts": {
        "build:supervisor": "cargo build --manifest-path native/supervisor/Cargo.toml --locked",
        "build:tui": "go -C native/tui build -trimpath -ldflags '-s -w' -o dist/curiosity-tui ./cmd/curiosity-tui",
        "build:experimental-binary": "cargo build --release --manifest-path native/supervisor/Cargo.toml --locked && bun run build:tui && bun tools/build-experimental-binary.mjs",
        "build": "bun run build:supervisor && bun run build:tui && tsc -p tsconfig.build.json",
        "check-types": "tsc --noEmit",
        "install:experimental-binary": "bun run build:experimental-binary && bun tools/install-experimental-binary.mjs",
        "lint": "test -z \"$(gofmt -l native/tui)\" && go -C native/tui mod verify && go -C native/tui vet ./... && cargo fmt --manifest-path native/supervisor/Cargo.toml --check && cargo clippy --manifest-path native/supervisor/Cargo.toml --locked --all-targets -- -D warnings && node tools/verify-architecture.mjs",
        "parity:check": "bun tools/verify-parity-qualification.ts",
        "test": "bun run build:supervisor && cargo test --manifest-path native/supervisor/Cargo.toml --locked && go -C native/tui test ./... && bun test tests/*.test.ts",
        "test:experimental-binary": "bun run build:experimental-binary && bun test tests/darwin/binary-distribution.test.ts",
        "tui": "bun run build:supervisor && bun run build:tui && bun src/tui.ts",
        "verify": "bun run parity:check && bun run check-types && bun run lint && bun run build && bun run test"
      },
      "exports": {
        ".": {
          "types": "./dist/index.d.ts",
          "import": "./dist/index.js"
        },
        "./thread-projections": {
          "types": "./dist/thread-projections.d.ts",
          "import": "./dist/thread-projections.js"
        },
        "./thread-projections/node": {
          "types": "./dist/thread-projections-node.d.ts",
          "import": "./dist/thread-projections-node.js"
        }
      },
      "bin": {
        "curiosity-harness": "./dist/tui.js"
      },
      "files": [],
      "implicitConfigSubpaths": [
        "native/supervisor/Cargo.lock",
        "native/tui/go.mod",
        "native/tui/go.sum",
        "tsconfig.json",
        "tsconfig.build.json",
        "turbo.json"
      ],
      "dependencies": [
        {
          "name": "@ai-sdk/anthropic",
          "section": "dependencies",
          "version": "3.0.113",
          "classification": "external",
          "protocol": "exact"
        },
        {
          "name": "@ai-sdk/google",
          "section": "dependencies",
          "version": "3.0.113",
          "classification": "external",
          "protocol": "exact"
        },
        {
          "name": "@ai-sdk/openai",
          "section": "dependencies",
          "version": "3.0.101",
          "classification": "external",
          "protocol": "exact"
        },
        {
          "name": "@ai-sdk/openai-compatible",
          "section": "dependencies",
          "version": "2.0.72",
          "classification": "external",
          "protocol": "exact"
        },
        {
          "name": "@curiosity/runtime",
          "section": "dependencies",
          "version": "workspace:*",
          "classification": "workspace",
          "protocol": "workspace"
        },
        {
          "name": "@openai-oauth/ai-sdk",
          "section": "dependencies",
          "version": "2.0.0",
          "classification": "external",
          "protocol": "exact"
        },
        {
          "name": "@openai-oauth/local",
          "section": "dependencies",
          "version": "2.0.0",
          "classification": "external",
          "protocol": "exact"
        },
        {
          "name": "@types/bun",
          "section": "devDependencies",
          "version": "1.3.14",
          "classification": "external",
          "protocol": "exact"
        },
        {
          "name": "ai",
          "section": "dependencies",
          "version": "6.0.266",
          "classification": "external",
          "protocol": "exact"
        },
        {
          "name": "effect",
          "section": "dependencies",
          "version": "4.0.0-rc.111",
          "classification": "external",
          "protocol": "exact"
        },
        {
          "name": "marked",
          "section": "dependencies",
          "version": "12.0.2",
          "classification": "external",
          "protocol": "exact"
        },
        {
          "name": "marked-terminal",
          "section": "dependencies",
          "version": "7.3.0",
          "classification": "external",
          "protocol": "exact"
        },
        {
          "name": "typescript",
          "section": "devDependencies",
          "version": "5.9.2",
          "classification": "external",
          "protocol": "exact"
        }
      ],
      "workspaceMember": true,
      "executionMetadata": [
        {
          "kind": "lifecycle-script",
          "path": "scripts.test",
          "value": "bun run build:supervisor && cargo test --manifest-path native/supervisor/Cargo.toml --locked && go -C native/tui test ./... && bun test tests/*.test.ts",
          "classification": "reviewed",
          "reason": "Required harness test entrypoint builds and tests the locked narrow Rust supervisor and pinned Go presentation module before executing focused Bun tests."
        }
      ]
    },
    {
      "path": "apps/docs",
      "manifest": "apps/docs/package.json",
      "name": "docs",